{
  "id": "sample-tourism-cabalgata-rio",
  "title": "Cabalgata — 2.500 metros y río Chillón",
  "kind": "service",
  "category": "tourism",
  "status": "TO_CONFIRM",
  "visibility": "TENANT",
  "source_status": "STALE",
  "summary": "Recorrido ecuestre histórico con acceso al río; confirmar condiciones actuales.",
  "provider_name": "Fundo Santa Rosa de Quives",
  "location": "Santa Rosa de Quives, Lima, Perú",
  "price_minor": null,
  "currency": "PEN",
  "price_unit": "persona",
  "conditions_public": "Confirmar ruta habilitada, guía, condiciones de acceso al río y horario.",
  "images": [],
  "sample_only": true,
  "cta": {
    "type": "QUOTE",
    "label": "Consultar disponibilidad"
  },
  "source_ref": null,
  "updated_at": null
}
