{
  "id": "sample-tourism-equitacion-hora",
  "title": "Equitación y alta escuela — una hora",
  "kind": "service",
  "category": "tourism",
  "status": "TO_CONFIRM",
  "visibility": "TENANT",
  "source_status": "STALE",
  "summary": "Experiencia de equitación sujeta a disponibilidad del instructor y caballo.",
  "provider_name": "Fundo Santa Rosa de Quives",
  "location": "Santa Rosa de Quives, Lima, Perú",
  "price_minor": null,
  "currency": "PEN",
  "price_unit": "hora",
  "conditions_public": "Confirmar instructor, condiciones, horario y cupos.",
  "images": [],
  "sample_only": true,
  "cta": {
    "type": "QUOTE",
    "label": "Consultar disponibilidad"
  },
  "source_ref": null,
  "updated_at": null
}
